article_title,source_date,article_link,article_content,,* Source_date refers to the date that the article is placed into this CSV
[FEATURED NEWS] COUNTING ON ROBOTS IN TIMES LIKE THESE,18-Jun-21,https://www.htx.gov.sg/news/featured-news-counting-on-robots-in-times-like-these,"(Photo: SPF)

It’s not an R2D2 or C3PO, with endearing human emotions and human-like dexterity. But the humble invention of the M.A.T.A.R. is no less of a force to be reckoned with – for HTX engineers, our local police, and foreign workers at the dormitory. 

When we think of robots, we invariably conjure up images of high-powered bots like those in Star Wars and Transformers. We are drawn to robots that can interact with humans like any other human. But beyond these imaginary characters that we play with and are entertained by, robots in real life serve human needs, offering newfound conveniences and improving our lives in myriad ways. At a crucial time like the current COVID-19 situation, the pressing need to count on robots to help protect and save lives is even more felt.

That is where HTX’s Multi-purpose All-Terrain Autonomous Robots (M.A.T.A.R.) came in very useful. With more Government Quarantine Facilities (GQF) and isolation facilities being set up during this period, reinforcements in policing the living quarters to enhance their security are much needed. This led to M.A.T.A.R.s being deployed by HTX and the Singapore Police Force (SPF) to help with foot patrol and project police presence at a GQF and a foreign worker dormitory. 

The M.A.T.A.R.s’ autonomous patrolling capability has not only enhanced the efficiency of police ground ops, but also helped to reduce exposure of frontline officers, thus keeping them safe. The M.A.T.A.R.s also made the living quarters safer for residents by helping to ensure safe distancing, in place of human officers. 

M.A.T.A.R. patrolling the foreign workers dormitory (Video: SPF)

Realising the Potential of M.A.T.A.R.  
The use of M.A.T.A.R. today exceeded expectations of the HTX engineers who first conceived it while in the Ministry of Home Affairs (MHA) in early 2016. The project almost could not take off, as their peers then questioned the need for such a robot, with some seeing it as a potential white elephant. But having management’s support, they nevertheless pushed on with the effort, believing that it would result in something unique and useful for the Home Team.

Their confidence was boosted with M.A.T.A.R.’s first launch in 2018, when they received favourable responses and even queries from other countries to learn more about the robot. The experience of building M.A.T.A.R. from scratch – with a common framework architecture that allows integration of several key robotics technology building blocks (such as Simultaneous Localisation and Mapping, Obstacle Detection Obstacle Avoidance, path planning, road segmentation, cooperative behaviours), coupled with specific payload capabilities – was rewarding and valuable for further applications. With the robotics software developed, the team could apply it subsequently to multiple Home Team operations, for example perimeter surveillance, autonomous equipment transporter, and even augment Rover-X for search and rescue missions.

Although they already had a workable prototype of the M.A.T.A.R. in 2018, the engineers didn’t stop trying to improve on its capabilities. They wanted more, and had an insatiable desire to make the M.A.T.A.R. even better. In late 2018, they came up with the idea of incorporating a tethered drone as part of M.A.T.A.R. This would mean a quantum leap in M.A.T.A.R.’s capabilities, as having an aerial picture would give SPF a real advantage and improved situational awareness of the ground. That was a tough endeavor though – the timeline was short and budget was tight. But they eventually pulled it off in 2019, together with project partners.

Today, M.A.T.A.R. provides a 360-degree video feed to Police Command Centres, has audio communication functions for relaying instructions, is autonomous and can be controlled remotely. 

Force Multiplier Effect
M.A.T.A.R.s are currently being deployed for 24/7 tireless patrol at a foreign workers dormitory. “M.A.T.A.R.’s deployment to help augment police ground ops during the COVID-19 period, is a small but significant step for SPF, and a giant leap for HTX – in using robotics technology in real-life ops as a force multiplier,” said Deputy Director (Ground Robotics) Ong Ka Hing, who is the Technical Advisor of this deployment. Currently with HTX’s Robotics, Automation & Unmanned Systems (RAUS) Centre of Expertise, Ka Hing has more than six years of engineering experience at the MHA. He is also the technical lead in other HTX key robotics projects such as Rover-X, the search and rescue robotic dog, and the Automated Passenger In-car Clearance System (APICS).

Being one of the key people who built M.A.T.A.R. from scratch and worked on its enhancement through the years, he said, “It is gratifying to see the idea that the team conceived way back in 2016 come to fruition and be deployed for COVID-19 operations. We envisage that this would be the beginning of an exciting journey for HTX, and that there will be more to come.

“With eventual full-scale deployment of M.A.T.A.R., SPF and other Home Team Departments would be able to augment their manpower, thereby increasing their operational capacity and agility to meet the new challenges faced in future operations. The use of M.A.T.A.R. for SPF’s COVID-19 operations has helped the adoption of robotics and given SPF a glimpse into the potential of M.A.T.A.R.”.

Ong Ka Hing, Deputy Director (Ground Robotics), RAUS CoE, sharing with the media about M.A.T.A.R. (Photo: HTX)

Before the COVID-19 situation, M.A.T.A.R. has also been deployed to augment police operations at several major security events, such as the National Day Parade 2019, Marina Bay Countdown 2020 and Chingay 2020.

The force multiplier team’s persistence with M.A.T.A.R. is leading on wider applications and more advanced technologies. And the more M.A.T.A.R.’s capabilities are being employed in ground operations, the more able, informed and inspired is the team in deepening its relevance to improve, protect, even save lives.

Recognising its Benefits
Recounting the scenario when HTX RAUS Engineer Goh Boon Kiat first arrived at the dormitory where the M.A.T.A.R.s were deployed, he said, “It felt surreal to see what used to be a carpark and basketball court converted into an ops area with tentage and barricades. It was a stark reminder of the gravity of the COVID-19 situation.” 

He described how the dorm was segregated into zones – Red for residential area, Green for rest area, the command centre and SPF room where M.A.T.A.R. was housed. He said, after the route mapping for M.A.T.A.R. was done, there was no need any more for frontline officers to enter the Red Zone. All monitoring can be done from the Green Zone, and the robot will automatically navigate out of the Red Zone once its shift ends, for disinfection and return to charging station.

M.A.T.A.R. on patrol at a foreign workers dormitory (Photo: HTX)

M.A.T.A.R.’s deployment freed police officers of manual repetitive patrolling tasks, and substituted them in entering risky zones and performing risky operations. It can also respond to situations quickly, unlike human officers who first have to don full personal protective gear before heading onsite to address ground issues. 

Goh Boon Kiat, RAUS Engineer, with M.A.T.A.R. at its charging station (Photo: HTX)

Said Boon Kiat, “While we were doing some modifications onsite at the rest zone, we overheard the frontline officers having casual conversations about their family’s concerns over their well-being and children’s schoolwork. It impressed upon me that, although the mission of the robot may sound mundane, the benefits it brings are very real and extend beyond protecting our frontline officers, to their loved ones too.""

It was heartening too for HTX’s partners – ST Engineering and A*STAR, who had played an instrumental role in M.A.T.A.R.’s deployment and development – to see M.A.T.A.R. being used for critical missions during the COVID-19 period. 

The team at ST Engineering Land Systems said, “It’s a satisfying moment to see M.A.T.A.R. deployed in field where it extended HTX/SPF ground presence into areas not safe for security personnel to patrol and in times security manpower is stretched.”

A*STAR partners were similarly glad to see that their enabling technologies have contributed to the nation’s fight against COVID-19 during this difficult time. “We will continue to work closely with public sector agencies such as HTX, SPF and local companies to create innovative solutions that can help boost productivity and work processes,” they said. 

Bridging Distances and Impacting Lives
M.A.T.A.R.’s deployment is yet another demonstration of how technology enhances and impacts lives. Helped by their collaboration with industry and research partners, HTX engineers are close to fully operationalising M.A.T.A.R. for police operations beyond COVID-19. 

“Within the team, there is always a sense of camaraderie, driven by a common goal of wanting the Home Team to succeed. There is a lot of enthusiasm and excitement about technological developments, even those that are not within our individual areas, resulting in our chat group sometimes being flooded with articles. MHA and HTX senior management have also been very supportive of our initiative to lean forward in supporting SPF operations,” shared Ka Hing.

HTX RAUS officers who are part of the team working on M.A.T.A.R.: (from left) Engineer Vanessia Choo, Deputy Director Ka Hing, and Senior Assistant Director Lee Guoming (Photo: HTX)

Although working and living with robots is not new, it is no less wow. The conveniences and empowerment we enjoy with automation may seem simple and common, but they are not so at all. Behind the innovations are likely countless tries and efforts from many resilient and brilliant minds, behind the scenes and unnoticed in the public eye. But the human will and connection is nonetheless very present in doing the work of bridging distances and making a difference to lives through exploiting technologies.",,
[FEATURED NEWS] HTX AND SPF COLLABORATE TO USE DRONES TO ENHANCE GROUND OPERATIONS DURING COVID-19,18-Jun-21,https://www.htx.gov.sg/news/featured-news-htx-and-spf-collaborate-to-use-drones-to-enhance-ground-operations-during-covid-19,"(Photos by HTX)

As whole-of-government efforts to contain the spread of COVID-19 intensified following the Circuit Breaker measures, HTX’s Robotics, Automation & Unmanned Systems (RAUS) Centre of Expertise collaborated with SPF to trial drone technology to support SPF’s ground operations. 

In late April, HTX and SPF deployed two sets of drone box systems to survey an industrial estate located in the Western part of Singapore. 

Flying High

    (Video courtesy of SPF)

Without the need for an on-site operator, the drones can operate safely in hazardous and remote sites, and facilitate the viewing of difficult-to-access areas. Unlike conventional drones where a pilot is always required, these autonomous drones provide a vantage view over a large area and are therefore a much safer and more cost-efficient way of gaining greater insights for Police operations. 

The drones are launched autonomously from their respective drone boxes, monitored by the local Command and Control (C2) Centre operators. The drones are programmed to fly, via waypoints above the industrial estate to survey the perimeters and common areas, to track anomalies such as gatherings/congregations, etc. Live footage from the flights is streamed back to terminals at the backend Command Posts. 

According to Senior Engineer Low Hsien Meng from RAUS, who is part of the deployment team, the drones provide a wide coverage. They can pinpoint locations and zoom into certain areas, which might not be clearly visible to police officers on foot patrol or in vehicles. He added that the drones therefore augment SPF’s operational resource and capability in ensuring safety and security during the Circuit Breaker period

Advances in Drone Technology 

The Drone Box

The Drone Box is an advanced mode of unmanned flight operation. The robotic automation system found within the drone box not only ensures that drone batteries are fully charged and ready to be installed, but also outfits the drones with the most effective payload for each specific operation. With the mundane and time consuming tasks taken care of by automation, the drone deployment team can focus on conducting the mission at hand.  

The drone box solution is jointly developed by HTX, Airobotics Ltd and its local partner, SJ Defence Services Pte Ltd. 

Propelling Forward

For this trial, HTX-SPF deployed the *Extended Visual Line of Sight (EVLOS), which will allow the team to collect important technical data through flying in an urban built environment, and develop confidence in operating in such challenging terrains. With the successful deployment of the EVLOS drone box system in this trial, the team hopes to progress to its eventual goal of operating full Beyond Visual Line of Sight (BVLOS) flight from these drone boxes autonomously. 

As there is huge potential for BVLOS application in public safety, search and rescue and delivery of supplies, HTX is currently working with various Home Team departments to design and customise an effective BVLOS solution to meet their specific needs and requirements. For instance, HTX is also exploring the use of such technology to deliver Automated External Defibrillators to achieve a shorter response time.  

  
*Most drone operators navigate Visual Line of Sight (VLOS) which means that flights are operated within the pilot’s line of sight. EVLOS flights require a safety pilot to eyeball the drone and take over control if required, while the primary drone operator can be situated within a control room. In BVLOS flights, the drone operator has no visual reference of the physical flight and depends on the instruments on-board the drone for situation awareness.",,
[FEATURED NEWS] IDENTIFYING A FACE AMONGST THOUSANDS AT OUR BORDERS,18-Jun-21,https://www.htx.gov.sg/news/featured-news-identifying-a-face-amongst-thousands-at-our-borders,"Over 217 million people travelled in and out of Singapore in 2019. Part of our arsenal for detecting terrorists or wanted persons amidst the millions is a portable facial recognition system tucked in a luggage case which can be set up anywhere within minutes.
Home Team officers at the checkpoints have been alerted by their foreign counterparts to look out for a criminal who may be trying to enter Singapore. All they have to rely on is a photo of the criminal’s face, as he is likely to be using a forged passport.

Over 217 million people travelled in and out of Singapore in 2019. At the land checkpoints, about 415,000 people pass through daily and the number can go up to 475,000 during peak periods. It would be akin to searching for a needle in a haystack.

The evolution of biometry and video analytics have transformed the field of facial recognition. Smart technologies can do the job of accurately and efficiently scanning thousands of faces for a match with persons-of-interest.

While the Immigration & Checkpoints Authority (ICA) has been using facial recognition facilities at the checkpoint since 2012 , the introduction of portable facial recognition systems to checkpoints including Tuas Checkpoint, Singapore Cruise Centre and Changi Airport in July 2017 has enabled officers to act and react faster to threats. 

Fitting into a luggage case, each portable system can be set up at strategic locations within the checkpoint in 10 minutes, making it accessible and fuss-free for frontline officers. The network of cameras scanning and screening faces allows the system to identify the person-of-interest amidst huge volumes of travellers. 

These portable facial recognition systems can also be readily deployed by other Home Team Departments (HTDs) during events or at crowded places in Singapore to detect persons-of-interest. 

HOW DOES IT WORK?

The portable facial recognition system, comprising a laptop and a special video-camera, can be assembled within minutes.

 

Finding the right spot: HTDs identify strategic locations where they think the person-of-interest would need to pass through at the checkpoints or elsewhere.

Setting up: Officers carry a small luggage containing all the equipment they need, including a laptop and a special video-camera. Once they reach the identified spot, they can assemble their “portable facial recognition station” within minutes.

Directing the crowd: People are directed to walk past the station, where the camera will scan the crowd and screen their faces against a database of known persons-of-interest.

Smart technologies kick in: The features of each face are analysed using biometric facial recognition technology and matched against a database of faces of people listed by HTDs. The system can search against a large database, and even if there are changes in hairstyle, hair colour, and facial hair like a moustache or a beard, the facial recognition technology can accurately match the faces.

Near real-time alerts: Once there is a match, officers who are at the scene are alerted via a mobile device and can quickly detain the person.

[1] Implementation of the Automated Biometrics and Behaviourial Screening Suite (ABBSS) Command Centre at Woodlands Checkpoint ",,
[FEATURED NEWS] SECURING SINGAPORE'S BORDERS AGAINST COVID-19,18-Jun-21,https://www.htx.gov.sg/news/featured-news-securing-singapore's-borders-against-covid-19,"COVID -19 TEST KIT
The HTX COVID - 19 test kit is a
collaboration between the Home
Team Science & Technology Agency
(HTX ) and Veredus Laboratories
Pte Ltd , a company that specialises
in the development of molecular
diagnostic solutions

Scientists from the HTX Chemical,
Biological , Radiology , Nuclear & 
Explosives Centre of Expertise
designed the primers for the test kit
based on the full genome of the
COVID - 19 obtained from the Global
Initiative on Sharing All Influenza
Data ( GISAID ), a global platform
that enables rapid sharing of
influenza virus data. Veredus
provided their patented VereChip TM
technology , a Lab - on - Chip platform
integrating two powerful molecular
biological applications , Polymerase
Chain Reaction (PCR ) and
microarray.
The test kit is able to identify
COVID - 19 with high specificity and
sensitivity .
The test kits have been deployed at
the air , sea and land checkpoints
since 5 March 2020 .

Design of the Primers
The HTX scientists
found the COVID - 19
genome sequence
information on the
GISAID
The team then
designed primers
that will anneal to
targeted regions
which have the unique
genetic sequences of
the COVID - 19.

The Testing Process
The RNA of the samples are 
first extracted in the laboratory
and then transcribed and 
multiplied via a process known
as Polymerase Chain Reaction 
(PCR ) to amplify the signal of the
target virus in the sample so that
it becomes more detectable .
The PCR is performed by loading
the sample onto the VereChip
Lab -On -Chip system , which is
the size of a fingernail, and the
reading of results is done via a
microarray which is built into the
chip .
Source : HTX
Information correct as of 17 March 2020

When news of COVID-19 making people ill in China broke in January 2020, a team of scientists under the HTX Chemical, Biological, Radiological, Nuclear and Explosive (CBRNE) Centre of Expertise, leapt into action to develop a test kit that can detect the virus at the borders, quickly and accurately, to prevent infected travellers from coming in to Singapore.


Developing the Test Kit

When the COVID-19 genome sequence information was published on the Global Initiative on Sharing All Influenza Data (GISAID), a global platform that enables rapid sharing of influenza virus data, the HTX scientists started working on the design of primers to develop a COVID-19 test kit.  A primer is a short piece of DNA created to amplify a specific region of the target pathogen for identification using the Polymerase Chain Reaction (PCR) process.   

The design of the primers is critical to ensure that the test kit is able to detect COVID-19 with high specificity and sensitivity, similar to how a key with a specific design will be able to open the corresponding lock.  The scientists also incorporated degenerate primers to cover possible mutations of COVID-19.

These primers will be loaded on a Lab-on-Chip platform for tests to run. HTX collaborated with Veredus Laboratories, a company that specialises in developing molecular diagnostic solutions and patented the Lab-on-Chip platform.  This platform integrates two molecular biological applications, Polymerase Chain Reaction (PCR) and microarray.


How it Works

The testing process involves extraction, amplification and analysis. The RNA of the samples are first extracted in the laboratory, and then loaded on a chip. These chips are then processed and results will be available.

Using this platform, we are able to process individual samples instead of doing batch-processing. This allows results to be delivered quickly, so that infected persons can be informed and contact tracing be conducted as soon as possible. This enables us to limit the spread of imported cases.

 

Deployment of the Test Kit

From 2359h on 4 Mar 2020, travellers entering Singapore who are deemed to exhibit symptoms such as fever and respiratory illness are required to undergo a nasal and throat swab. The swab samples are brought to the HTX laboratory for screening.


3-in-1 Test Kit

The HTX test kit can also test for two diseases with just one sample – COVID-19 and SARS-CoV. In the future, it will also be able to test for the Middle East Respiratory Syndrome Coronavirus (MERS-CoV).",,
[FEATURED NEWS] HTX LAUNCHED AS FORCE MULTIPLIER FOR HOME TEAM,18-Jun-21,https://www.htx.gov.sg/news/featured-news-htx-launched-as-force-multiplier-for-home-team,"TUESDAY DECEMBER 3 2019 SINCE 1845
THE STRAITS TIMES

Prime Minister Lee Hsien Loong checking out a Rover -X robotic dog during the launch of the Home Team Science and Technology
Agency yesterday, as Mr Ong Ka Hing ( in black), deputy director for ground robotics at HTX’s Robotics , Automation & Unmanned
Systems Centre of Expertise , explained its functions. Those present included Senior Minister Teo Chee Hean (behind PM Lee),
Minister for Manpower and Second Minister for Home Affairs Josephine Teo ( far left) and Mr Chew Hock Yong ( right, in light blue
shirt), chairman of HTX's board of directors. ST PHOTO : JASON QUAH
HTX launched as force multiplier
for Home Team

A new statutory board was launched 
yesterday, with the mandate to develop
customised tech solutions and grow organic
capabilities for the Home Team . 
The Home Team Science and Technology
Agency (HTX ), with the “X ” symbolising
the ambition to be a force multiplier through
technology , was launched by Prime Minister
Lee Hsien Loong at Mediapolis .
Among its projects to secure Singapore's
borders , solve crimes , save lives and protect
public spaces are life -detecting robots and 
anti - drone vehicles.
The 1,300 -strong agency is currently
located at the Ministry of Home Affairs '
headquarters near Novena .
At the event, PM Lee urged the various
Home Team departments to see technology
as an integral part of their operations so that
HTX will succeed.
“Every commander, every officer must
embrace tech and welcome what HTX can
do for them , even when using tech means
disrupting existing routines and established
ways of doing things.”
This is a personalised copy.
Source : The Straits Times Singapore Press Holdings Limited . Permission required for reproduction
Source: The Straits Times © Singapore Press Holdings Limited. Permission required for reproduction. ",,
