article_title,source_date,article_link,article_content,,* Source_date refers to the date that the article is placed into this CSV
[FEATURED NEWS] MINISTER FOR HOME AFFAIRS NATIONAL DAY AWARDS,18-Jun-21,https://www.htx.gov.sg/news/featured-news-minister-for-home-affairs-national-day-award,"Congratulations to all our Minister for Home Affairs National Day Awards Winners!
Four HTX officers and two projects that our HTX units co-led received the Minister for Home Affairs National Day Awards 2020. The recipients were announced on 29 July 2020 at the Home Team National Day Observance Ceremony. They were among 105 Home Team officers who received the Individual Award and three Home Team projects which received the Team Award. The award recognises Home Team officers who have distinguished themselves through significant and commendable contributions in their respective areas of work. 33 members of the public, 15 Home Team volunteers, and 12 organisations were also presented awards for their significant contributions to the Home Team.

Minister for Home Affairs Mr K. Shanmugam commended all the award recipients for their commitment to keep Singapore safe and secure. “All our recipients have stepped forward when we needed them in times of need, in their own ways and they are role models and heroes for all of us. In these challenging times, let’s hold steadfast to our shared commitment to keep Singapore safe, secure and peaceful,” he said.

“Our heartiest congratulations to all the award winners this year. Their dedication, professionalism and spirit of innovation are an inspiration to us all,” said HTX Chief Executive Mr Chan Tsan.

On the HTX recipients, he said, “I mentioned at a recent HTX Town Hall that we are building HTX brick by brick and that our people are the centre of it all. All our officers across the Capability Planning, Development and Sustainment pillars have important roles to play in growing and building HTX to be the Home Team’s Force Multiplier. This year, I am pleased to see four of our officers recognised with Individual awards and two of our projects receiving Team awards. To the award winners and everyone at HTX, I thank you for your important contributions to the work of the Home Team in keeping Singapore safe and secure. Happy National Day!”

Read on to get to know our four individual award winners – Chan Sheau Shan, Mohamed Amir Arshad, Goh Eng Joo, and Wong Weiyang – from HTX and our two winning projects – T3-Xentinel and Project Heavy!


Minister for Home Affairs National Day Award (Individual) – Chan Sheau Shan
Lifelong Learning Journey

(Photo: Chan Sheau Shan)

For many of us, navigating the procurement process can be a daunting affair. Not for Chan Sheau Shan. As Deputy Director of Procurement Unit, Sheau Shan is a walking guide on MHA procurement procedures. With her expertise in procurement, Sheau Shan has guided and developed the competency of the MHQ Quotation Processing Unit and has been instrumental in setting up of the HTX Quotation Processing Unit.

A firm believer and proponent of lifelong learning, she has also been involved in other areas such as logistics and corporate services. She did a stint as Deputy Director with Finance and Admin (FAD)/MHQ, to gain exposure to other related areas in procurement. In HTX, she was involved in FAD’s Admin Transformation plan, to right size the FAD unit to oversee the specialist functions of Building & Infrastructure, and Procurement in FAD. She has also worked with the HTX Corporate team on the administrative functions that the new team was to take over. On receiving the award, she says, “The award spurs me to continue learning and to give my best.”

With deep knowledge and skillsets in procurement and corporate services, it is no wonder that officers often turn to Sheau Shan for advice and guidance to better understand procurement processes and the ‘blind spots’ to look out for.


Minister for Home Affairs National Day Award (Individual) – Mohamed Amir Arshad
Justice through Science

(Photo: Amir Arshad, second from right)

If there is one thing that keeps Senior Crime Scene Specialist Mohamed Amir Arshad going on strong at his job for eight years, it is the job satisfaction in knowing that his work plays an important role to achieve justice for victims and their families.

Amir’s keen interest in science and criminal investigation led him to a job in forensics science. “I have always been intrigued with how the application of science is able to reconstruct a crime that had taken place. As a forward deployed officer, I am able to share my expertise in the crime scene and collaborate with investigators to tackle challenges in the criminal investigation. At the same time, I can explore new advanced technology to combat limitations faced in my line of work,” he says. 

Throughout his service, Amir has consistently delivered quality forensic services to the investigation fraternity. He is widely regarded to be a highly skilled and motivated forensic specialist who possesses strong leadership traits. These qualities led to his deployment in Nepal as part of a disaster victim identification mission during the 2015 earthquake.

When asked what his advice would be to young people looking for a career in forensics, he quips, “If you want a career that is more than just a job, HTX is the place to be.”


Minister for Home Affairs National Day Award (Individual) – Goh Eng Joo
Justice through Science

(Photo: Goh Eng Joo)

“Change is the only constant in life.” With over 22 years of experience at MHA, Supt Goh Eng Joo’s work is testament to this proverb. He has held many key appointments in MHA, mainly Head of Training at the Home Team School of Criminal Investigation (HTSCI), and Commanding Officer (CO) of Bedok North Neighbourhood Police Centre (NPC). 

He led the HTSCI through its innovation journey, by enabling process changes to improve training productivity from traditional classroom-based lessons to application-based ways of learning for Criminal Investigation Training. For helping the Home Team take a giant leap towards innovation, he received the Exemplary Leader Award at the 2019 Public Sector Transformation Award. As CO NPC, he was an inspirational leader and coach to his subordinates.This laid the strong foundation to Bedok NPC clinching the best NPC within the Division during the inaugural NPC League competition.

Currently on secondment at HTX, Eng Joo has served as the Deputy Director for Trials & Experimentation, and is now the Deputy Director for Partnerships. He has put in place key work processes to ensure agile project management. He also serves as a guide to younger officers by coaching and mentoring programme managers and executives under his charge.

Implementing change is no easy feat but Eng Joo remains enthusiastic as he continues to contribute towards HTX’s and MHA’s success through transformation. 


Minister for Home Affairs National Day Award (Individual) – Wong Weiyang
A Curious Mind

(Photo: Wong Weiyang)

Have you ever wondered about the existence of your doppelgänger or the existence of people born with super recognition ability, who can recognise and differentiate faces, sometimes better than machines and software? For Wong Weiyang, a Senior Lab Manager at HTX’s Biometrics & Profiling CoE, both phenomenon are subjects of fascination and curiosity. 

It is this interest that sparked Weiyang’s journey with MHA in 2013. He spent five years managing the Automatic Interview System – a secondary screening process used by the Immigration & Checkpoints officers and assisted in the review and data analysis of more than 25,000 travellers. 

With the formation of HTX, Weiyang took on the challenge of a new field of expertise under the Biometrics & Profiling unit. Despite picking up biometrics only for a short period, he has provided invaluable advice to the ICA, in their push to implement the New Clearance Concept, and the extensive use of Iris and Face Biometrics as an integral component of the clearance process for travellers.  

Weiyang has been consistently applying his wide-ranging and deep knowledge in S&T to support Home Team operations, quickly picking up new skills and knowledge, and constantly seeking to improve and create impact at a higher level. His work motto is, “There is a way out of every box, a solution to every puzzle; it’s just a matter of finding it.”


Minister for Home Affairs National Day Award (Team) – T3-Xentinel
A Team Effort – Countering Drones

Drone intrusions pose a serious safety and security threat to Security Sensitive Locations (SSLs) and events protected by the SPF. Protection against drones is labour intensive, but with the help of technology and domain experts, challenges can be addressed. A team comprising HTX, SPF, and DSO was formed to meet the challenge of developing an effective and expedited counter drone solution for SSL. 

The team conceptualised and developed a system that was commissioned in 14 months. This is a noteworthy achievement for a full featured counter drone system with capabilities to detect, identify and interdict drones using a combination of cutting-edge technologies. To achieve this, the team put in long working hours, on weekends and public holidays.  

(The T3-Xentinel project team with the system. Photo: HTX)

For the excellent teamwork, dedication to duty, operational efficiency, and integration of innovative technologies, the T3-Xentinel project team was presented with the Minister for Home Affairs National Day Award (Team).

 (The T3-Xentinel project team. Photo: HTX)

On receiving the award, co-Project Team Leader, Director/Land Systems Eric Chua and his team are elated. “The T3-Xentinel team is indeed humbled by this great honour. The award is a strong testament of the excellent collaboration of the multi-domain team from Land Systems CoE, RAUS CoE, Central Procurement Office and Strat Comms, where we leveraged the strengths and expertise of each team member to deliver the stunning prototype in an incredibly challenging schedule. The award is also a strong confirmation of our value-add in providing innovative and advanced S&T solutions that contribute towards HTX’s focus to “eXponentially impacting Singapore’s safety and security,” said Eric.

“The team from RAUS CoE working on counter drone technologies is very honoured to receive this prestigious award. We are Xceedingly appreciative of the highest level of recognition accorded by MHA’s Senior Management. Personally, I am very proud of the RAUS team who committed countless hours and personal sacrifices to ensure that the systems were delivered with the required capabilities. Moving forward, the team commits to continue striving towards delivering more cutting edge counter drone technologies to the Home Team,” added Director/RAUS CoE, Cheng Wee Kiang who also served as co-Project Team Leader.

The HTX officers involved in this project are:

Cheng Wee Kiang

Director, RAUS

Eric Chua Hing Han

Director, Land Systems

Chua Song Heng

DD, RAUS

Mok Shao Hong

DD, Partnerships

Alen Ke Wai Loon

Senior Engineer, RAUS

Nicholas Chong

Manager, PMC

Brina Seow Ying Ming

Engineer, RAUS

Rajinder Singh

SDD, CPO

Khoo Yew Beng Rodney

AD, CPO

Tan Puay Hia Vivian

Manager, CPO


Minister for Home Affairs National Day Award (Team) – Project Heavy 
A Team Effort – Fighting Fire

Battling fires get more dangerous and harder when it is out at sea. That is why the SCDF has been customising firefighting vessels that are more agile and powerful. With these vessels, SCDF is now able to handle beyond typical fires at sea. The new capabilities include large petrochemical fires, mass evacuation, and marine Chemical, Biological, and Radiological (CBR) contamination.

In delivering the new capabilities, HTX units - Marine Systems CoE, Joint Capabilities Programme Management Centre (PMC) and Police PMC - worked with SCDF and DSTA.

(Photo: SCDF)

The Heavy Fire Vessel (HFV) is designed to contain and address large scale fires in Singapore’s maritime waters and coastal areas and is capable of achieving a throw distance of at least 150m, allowing users to fight fire from afar. It is equipped with a CBR protection and detection system to detect harmful threats and perform hazardous material rescue missions out at sea. In addition, the HFV is capable of launching an inflatable boat to swiftly reach any survivors safely.

(Photo: SCDF)

The Heavy Rescue Vessel (HRV) is designed to serve as SCDF’s primary rescue and command platform. It is capable of accommodating up to 300 survivors in the rescue room and carry additional life rafts for 500. It is also equipped with a first aid room to treat casualties. 

(Photo: SCDF)

The Marine Rescue Vessel (MRV) is able to perform fast incident response in any fire or rescue incidents within Singapore Territorial Waters. The MRV has a recessed rescue zone that would facilitate lifting of survivors out at sea and accommodate 30 survivors in the rescue room. A CBR detection and protection system was also incorporated into its design, so that it is capable of conducting HazMat Rescue operations in hot zones.

On receiving the award, Director/Marine Systems, Chung Kam Sam said, “We are excited to deliver these new vessels with enhanced features and specifications to the SCDF. The HTX/DSTA team is grateful for the opportunity to collaborate with SCDF to deliver this world-class capability, and enhance our ability to handle incidents in our waters.”

 
Congratulations to all our winners!",,
[FEATURED NEWS] MARKSMEN IN THE MAKING WITH SMART TRAINING TECHNOLOGY,18-Jun-21,https://www.htx.gov.sg/news/featured-news-marksmen-in-the-making-with-smart-training-technology,"A police officer practising at the live firing range (Photo: HTX)

Every little breath, every twitch of your finger, or even blinking too often can cause you to fail, miss the mark and possibly result in a loss of life in the worst instance.

Shooting a gun or revolver accurately is a skill that demands precision. You might have tried shooting in a video arcade but that is very different from the real-life experience which Singapore police officers have to rigorously train for.

They even have to take a yearly revolver shooting test to ensure that they are up to the mark.

The officers are faring well, with over 90 percent passing the test every year. But the police force wanted to improve the scores – and ultimately boost public safety.

Previously, while warming up before the test, the police officers were only able to see where their shots had landed when the target boards were retrieved at the end of the warm-up shoot or the basic firing shoot. They had to rely on the instructor to give them feedback retroactively on areas they could improve on, based on the instructor’s experience and observation of the grouping of the shots. There was no real-time analysis after each shot was fired.

While most passed the test, the minority who failed could not go back to work on the frontline until they retook the test and passed it. 

A target board showing where the shots landed (Photo: HTX)

Today, officers’ firearm competency can be improved using a better training system. The Enhanced Live Firing Range System (ELFRAS), developed by the HTX Human Factors and Simulation Centre of Expertise and the Singapore Police Force, uses sensors and analytics to improve the shooting accuracy of those taking the test.

The system not only provides information on the grouping of shots, but also does real-time analysis of human factor indices such as weapon handling, breathing, shooting posture and stance, trigger motion, gaze fixation and visual alignment, so that timely and targeted training feedback can be provided.

The ELFRAS giving real-time guidance to help officers improve their shooting skills (Photo: HTX)

It also has a video-monitor which displays the shots on the target in real time, so officers can see immediately how they have performed.

But beyond that, ELFRAS tactically deploys sensors to pick up minute physiological human factors, which could affect the shot accuracy of the person taking the test:

A weapon sensor, attached to the revolver and pistol, measures if the officer is handling his weapon in the right way for maximum accuracy. It also diagnoses typical poor weapon handling issues related to the pulling of the trigger and gripping of the weapon, amongst others.
A pair of glasses with eye-tracking sensor can compute if and how long the officer has fixed his gaze on the target through the front and rear sight of the weapon, and even measure if he has blinked his eyes during the shot.
A breathing sensor tells the officer if his breathing technique and even inadvertent swaying may result in general body movements which could impact shot accuracy.
A posture detection system comprising a pair of cameras at the shooting lane and backend pattern recognition algorithm reads and compares the officer’s posture against a range of ideal shooting postures. 

Multiple sensors capturing shooting performance for review and improvement (Photo: HTX)

The data is further analysed and compared against best practices, so the shooter gets recommendations on how he can improve. For instance, he may learn how to adapt his breathing techniques to get better shots. The HTX team is also providing detailed design recommendations for the user interface to provide trainers with a one-glance view of the overall performance, including sufficient shot-by-shot detail so that the trainer can gain immediate insight on the performance gaps. This will enable the trainer to provide timely intervention to the trainee in between shots.

Quick summary of last shots at the same target distance for quick review of factors affecting performance (Photo: HTX)

ELFRAS also monitors the shooting performance of officers not just within a single shooting exercise but over multiple exercises as well. With all the data, training pedagogy can be customised to increase the number of marksmen.

Apart from the police force, ELFRAS could be used by frontline officers in other Home Team departments like the Central Narcotics Bureau, and the Immigration and Checkpoints Authority.",,
[MEDIA RELEASE] NEA LEADS SCIENTIFIC TEAM IN WASTEWATER SURVEILLANCE TRIALS FOR ASSESSMENT OF COVID-19 TRANSMISSION,18-Jun-21,https://www.htx.gov.sg/news/media-release-nea-leads-scientific-team-in-wastewater-surveillance-trials-for-assessment-of-covid-19-transmission,"Wastewater-based COVID-19 surveillance complements clinical testing and can provide an additional indicator to assess the spread of disease in a community.

Singapore, 19 June 2020 – The National Environment Agency (NEA) has initiated a pilot surveillance programme to screen wastewater samples for SARS-CoV-2, the causative virus of COVID-19. The amount of viral material in wastewater from a community could reveal the level of COVID-19 spread in the community, and trigger the necessary response plans and mitigation actions, such as individual testing and isolation. Supported by National Water Agency PUB and Home Team Science and Technology Agency (HTX), the novel approach has complemented the Inter-Agency Task Force’s1  efforts in assessing the situation and reducing the transmission of COVID-19 in the workers’ dormitories. 

Gleaning information from wastewater 

2       Wastewater surveillance is a promising method for assessing the COVID-19 situation, as infected individuals, including those with mild or no symptoms, could shed the virus in their stool. Since February 2020, scientists from NEA’s Environmental Health Institute (EHI), with scientific inputs from Nanyang Technological University and its research centre Singapore Centre for Environmental Life Sciences Engineering (SCELSE), Singapore-Massachusetts Institute of Technology Alliance for Research and Technology (SMART) and the National University of Singapore, have developed a methodology for wastewater sampling and testing for COVID-19. With support from PUB and HTX, the team has been sampling wastewater from the Water Reclamation Plants (WRP) and workers’ dormitories. In the laboratory, a sensitive molecular assay is used to screen the samples and quantify the genetic material of the virus.

3       Results from the testing of the wastewater from the WRPs showed that the level of COVID-19 viral ribonucleic acid (RNA) was not detected when there were 160 COVID-19 cases reported nation-wide as at 9 March 2020. However, the RNA levels became detectable in late March 2020, which correlated with the increase in cases detected in foreign workers’ dormitories. This demonstrated the usefulness of wastewater surveillance as a monitoring tool for SARS-CoV-2.

4       “Several reports overseas have shown that wastewater testing at treatment plants could be useful for early detection of COVID-19 transmission in the community. However, at low level transmission, wastewater surveillance at the treatment plant appears to be less sensitive than clinical surveillance of cases in Singapore. This is likely due to our intensive clinical testing regime. Monitoring is ongoing to determine the trending of the concentration of viral material at the WRPs, and the relationship between the viral material concentration and prevalence of COVID-19 in Singapore”, explained Assoc. Prof Ng Lee Ching, Director of NEA’s Environmental Health Institute.

5       Detection of viral material or RNA in the wastewater does not suggest the presence of viable or infectious virus. Without a host, the virus will not be able to propagate over time in wastewater. As an added preventive measure, wastewater from locations with COVID-19 cases, such as hospitals, isolation facilities and dormitories, are disinfected with chlorine at the premises before discharge into the public sewers. Disinfectants like chlorine can effectively inactivate the viruses.  

Wastewater testing to support dedicated efforts at workers’ dormitories

6       Testing of wastewater to assess the situation of COVID-19 in a community or geographical population catchment is not new. However, NEA’s EHI has brought the science of wastewater testing further by using it to support the Inter-Agency Task Force’s dedicated effort in monitoring and management of COVID-19 transmission among workers in dormitories (refer to Annex A for pictures of lab and field work). The pilot programme involves monitoring wastewater in manholes of 20 large dormitories to provide an additional indicator that complements the clinical tests to assess the COVID-19 situation and guide the progressive clearance of the dormitories. 

7       For dormitories in the pilot programme with no detected COVID-19 cases, a zero reading for SARS-CoV-2 material in the wastewater provided the added assurance that the dormitories remain free from infection, and to allow the workers to leave the dormitories for work. On the other hand, viral material was detected in the wastewater of some dormitories, and this had prompted more swab tests for workers at these dormitories, leading to more detections and isolation of cases, including asymptomatic ones. This facilitated a more targeted swabbing strategy and contributed to the mitigation of further transmission.   

8       The trial results at the dormitories also show that the concentration of SARS-CoV-2 material in wastewater is related to the prevalence of COVID-19 in the dormitories. The team has thus far demonstrated the utility of wastewater testing as a warning system for the presence of the COVID-19 cases, and that the trending of SARS-CoV-2 concentration over time can determine if infection control measures taken have been effective. Wastewater samples can also capture information on a cross-section of the community, which allows for the monitoring of large groups. If positive signals are detected from wastewater at a particular site, clinical testing for COVID-19 can be carried out for the affected community, allowing screening for COVID-19 to be carried out in a more targeted manner. Although the approach has been useful in detecting COVID-19 cases, more research is needed to understand the sensitivity of the method in detecting early or a few number of cases.

9       Despite its potential, the use of wastewater surveillance to detect COVID-19 spread is still in its early stages. NEA is working to ramp up its capacity to increase its coverage by expanding sampling to more wastewater nodes, which would improve the ability to pick up transmission. More information on the results of the wastewater surveillance in Singapore will be revealed when ready. 

JOINTLY ISSUED BY NEA, HTX & PUB
19 JUNE 2020

1Led by the Ministry of Manpower and comprises the Ministry of Health, the Singapore Armed Forces and the Home Team, the Inter-Agency Task Force has been set up to support foreign workers and dormitory operators in managing COVID-19. 

ANNEX A

Photos of field work 

Photos of lab work 
(Photos: NEA, PUB, HTX)
",,
