article_title,source_date,article_link,article_content,,* Source_date refers to the date that the article is placed into this CSV
[FEATURED NEWS] HTX’S ONLINE CYBERSQUAT HUNTER BEATS SCAMS AT THEIR OWN GAME,18-Jun-21,https://www.htx.gov.sg/news/featured-news-htx-s-online-cybersquat-hunter-beats-scams-at-their-own-game,"HTX’s newest innovation hunts down phishing websites to keep Singapore’s cyberspace safe.

At first glance, these two ICA websites look completely identical. Only upon closer inspection, does the viewer realise that the URLs are different. But to the Online Cybersquat Hunter, the differences are blindingly obvious.

Figure 1. Screenshot of ICA Public Advisory (Credit: ICA)

Online phishing scams, such as the fake ICA one above, have seen a tenfold increase from 2019 to 2020. Many malicious websites pose as official websites to deceive victims into divulging sensitive information, such as passwords and credit card details.

In many cases, these sites are only reported to the police after the scammers have already gained access to the victim’s information and the damage is done.

That is why HTX’s Q Team Centre of Expertise made it their mission to pre-emptively hunt down these malicious sites and exponentially increase police efforts in shutting down scams – by creating the Online Cybersquat Hunter (OCH).

How it works

The OCH uses AI with image and text analytics to automatically detect fake sites before they are even reported.

It does this by crawling through up to 500,000 websites on the public domain daily to see if they contain domain names, logos, and key words similar to those used on official websites.

OCH Project Team

Ng Gee Wah – Director, Q Team

Terence Tan – Deputy Director (DD), Q1

Tan Wei Lin – Engineer, Q1

Lim Ming En – Engineer, Q1

Michael Tay – DD Cybersec Ops, Ops Sys SC; DD Exercise & Evaluation, CS COE

Lucas Kan – Head, Cybersec SOC Ops, Ops Systems SC

Figure 2. From left to right: Engineer Tan Wei Lin, Director Ng Gee Wah, Deputy Director Terence Tan, Engineer Lim Ming En. Deputy Director Michael Tay and Head of Cybersecurity Operations Lucas Kan are not pictured. (Credit: HTX)

Development

Q Team worked with inputs from the Ministry of Home Affairs’ (MHA) Security Operations Centre and Singapore Police Force – developing, prototyping, and rigorously testing out many iterations before settling on the current version.

“At every tool developmental phase, there was significant active discussions, brainstorming of more ideas, defining and shaping attributes that could help us identify fake websites,” said Q Team’s deputy director Dr Terence Tan.

After an intensive month of rapid development, the OCH was deployed in Dec 2020 and has been in use ever since.

Applications

Currently, the OCH is focused on scanning for fake websites targeting MHA’s public service websites, such as the Singapore Police Force, Singapore Civil Defence Force, and ICA. Some key local banks and online delivery services are on trial as well.

“Our technology becomes more sophisticated and better at delivering outcomes, as we understand more about these websites through information gathering as quickly as possible. As our algorithm improves, our outcomes will increase exponentially as well,” said Dr Tan.

Q Team will continue to develop OCH to make it more effective and efficient, ensuring that our cyberspace will be a safer place for all.

The OCH was also covered in the Straits Times on 26 May 2021.

‘Hunter’ targets scam sites in S’pore, even before they can trick people

https://str.sg/3kpT",,
[FEATURED NEWS] IN CELEBRATION OF TEAM CBRNE AND THEIR ACHIEVEMENTS...,18-Jun-21,https://www.htx.gov.sg/news/featured-news-in-celebration-of-team-cbrne-and-their-achievements,"The month of April 2021 has proven to be both a momentous and evocative month for our team at CBRNE for two reasons.

CBRNE first scored a two-page write-up in CBRNe World's April issue, and second of all, a recognition by Immediate Past Minister for Health Mr Gan Kim Yong for its contributions in the fight against Covid-19 testing.

CBRNe WORLD (April 2021 Issue)

As a young agency with a new team that has been put together for less than 18 months, this two-page write-up in the April 2021 issue puts us firmly on the world stage.

CBRNe World, as we know, is the world’s leading title for all things CBRNE, bringing together the civil society, military leaders, academia, government agencies, research, industry and more.

In it, we had shared what motivates us in what we do, our plans, focus, and the way HTX Centres of Expertise come together and collaborate, as illustrated vividly by our Covid support efforts.

Live Covid-19 Ops (Photo: Zan Xin, CBRNE Associate)

It is indeed a proud moment of reckoning as it marks Singapore and HTX as experts in the field and its contributions to the domain.

Noteworthy at the close of the article, Director May Ong had further made a callout to build on the opportunity to educate and outreach, for global states and institutes to cooperate on the peaceful use of science, considering our environment today. She had separately explained that through demystifying and information sharing, it instills interest in our youths early and creates an understanding of ways to contribute to the world as a scientist.

As Director May Ong says it: “It is one bucket list item achieved!”

To May and the CBRNE team, we say: “Well done! You need to aim way higher now!”

IN CELEBRATION OF GLOBAL MEDICAL LABORATORY PROFESSIONALS WEEK 2021

This year, April 18 to 24, was marked as the Global Medical Laboratory Professionals Week.

In celebration of it, the HTX CBRNE Team was recognized by the Immediate Past Minister for Health Gan Kim Yong, for its participation and efforts.

While not your typical medical laboratory professionals, who can ever forget how the team rose to the occasion, when Covid hit us?

Pivoting from an environmental testing lab, to handle human nature samples in 48 hours, decontaminating the lab, adjusting workflow, adapting skillsets, to steep learning curves of parallel testing, stepping up volumes, recalling and reinforcing resources at HTX Pasir Panjang lab.

In action at Pasir Panjang CBRNE lab facilities (Photos: HTX)

In August 2020, we were awarded the Ministry of Health Private Health Medical Clinic license. The laboratory was further ranked TIER 3 as a result of its performance and speed for results. It is a testament of the medical laboratory work we do and affirmation of confidence of our ability to handle all test cases.

This is truly an amazing accolade.

Thank you to all for the little and big sacrifices made, as we continue our journey.",,
[MEDIA RELEASE] HARNESSING TECHNOLOGY TO AUGMENT ROAD TRAFFIC ACCIDENT INVESTIGATIONS,18-Jun-21,https://www.htx.gov.sg/news/media-release-harnessing-technology-to-augment-road-traffic-accident-investigations,"Investigation Officers (IOs) from the Traffic Police (TP) of the Singapore Police Force (SPF) and Crime Scene Specialists (CSS) from HTX (Home Team Science & Technology Agency) use technology to carry out proper documentation of road traffic accident scenes, and provide critical information and valuable insights for investigations.

Technology devices that complement officers’ investigations

Terrestrial 3D Scanner
2          The terrestrial 3D scanner can be operated by a single officer under total darkness or in bright daylight to scan the scene of the traffic accident in minutes, depending on the scale of the accident. It does so by projecting a laser beam within its line of sight onto the surface of objects, creating a comprehensive virtual model of the scene, along with proper documentation of measurements and spatial positioning of key evidence which are critical to the investigation work by the IOs subsequently.

3          Data collected can also be used for the purpose of reconstructing traffic accidents. Stakeholders involved in the investigation can therefore revisit the accident scene multiple times thereafter, without disrupting traffic flow.

Handheld 3D scanner
4          The handheld 3D scanner is a lightweight and portable device that allows CSS officers to document tight and confined spaces. Used mainly in instances where greater details of a specific area of interest are required, the scans generated complement those from the terrestrial 3D scanner, piecing together more comprehensive information for investigations.

5          Operated by a single CSS, the terrestrial and handheld 3D scanners enable efficient documentation and better analyses, augmenting the capabilities of IOs from the TP during road traffic accident investigations.

6          With traffic accidents usually occurring at high-traffic volume locations under punishing conditions, it is crucial for the accident scene to be processed quickly so as to return it to normalcy as soon as possible. The terrestrial and handheld 3D scanners from HTX are technological devices that enable officers to process the scenes more efficiently without compromising on accuracy, or the safety of officers at the scene.

SINGAPORE POLICE FORCE
HOME TEAM SCIENCE & TECHNOLOGY AGENCY
31 MARCH 2021 @ 6:00 AM
",,
[FEATURED NEWS] KICKING OFF TECHXCHANGE WITH RENOWNED FORENSIC SCIENTIST DR HENRY LEE,18-Jun-21,https://www.htx.gov.sg/news/featured-news-kicking-off-techxchange-with-renowned-forensic-scientist-dr-henry-lee,"Renowned forensic scientist Dr Henry Lee may be based in the US but he has a good working relationship with HTX. Speaking at the inaugural TechXchange on “The State of Forensic Science in the US” via Zoom on January 20, he recalled how he attended the launch of HTX in 2019 in Singapore. 

“HTX is way ahead of the curve in Forensics because when it comes to the future of forensics, you guys already know about it,” he shared during the Zoom webinar. 

“The future [of Forensics] is going to be related to artificial intelligence and big data for the reconstruction of crime scenes,” he added. 

Known for his critical role in the investigation of the murder cases involving O.J. Simpson and the “Woodchipper” murderer, Dr Lee is the founder of the Henry C. Lee Institute of Forensic Science at the University of New Haven, Connecticut, USA. 

Dr Henry C. Lee conducted an exclusive Zoom Webinar for HTX (Photo Credit: Dr Henry Lee)

“Dr Lee has been a close strategic partner of the Home Team for a good number of years, assisting the Police with several high-profile investigations,” said Dr Portia Loh, Acting Director, HTX Forensics Centre of Expertise (CoE). 

To foster knowledge sharing and dialogue, HTX launched TechXchange, a series of talks that are presented by leading scientists and experts.

“After kicking off TechXchange with such a distinguished personality, the other [sessions] will have a hard act to follow. We are looking at not only eminent authorities in their respective fields from other parts of the world, but also our very own experts from HTX,” she added. 

According to her, Dr Lee was willing to share his insights with HTX staff and colleagues from Home Team Departments (HTDs) given the strong friendship and working relationship built over the years. 

Dr Lee shared photos of his visit to HTX in 2019 during his Zoom webinar

Some 170 HTX staff and colleagues from HTDs signed up for the webinar, eager to learn from the session. 

Dr Kennard Gan, HTX’s Senior Forensic Scientist was spurred by the session to consider the role of new technologies in the field of forensic science. “In the new age of artificial intelligence (AI), forensic scientists have a pivotal role in balancing the tasks assigned to automation and those that require human logic. At this moment, I’d be uncomfortable if I were to be prosecuted based on an AI’s interpretation,” he said. 

Meanwhile, Irene Ng, Senior Crime Scene Specialist, Criminal Investigation Department (CID) said Dr Lee emphasized the importance of pattern evidence in crime scene investigation. This evidence includes blood pattern, paint chips and bite marks, etc., which serve as clues to the sequence of events and link suspects to a crime scene.

As such, Dr Lee stressed that this evidence is as important as identifying evidence such as DNA. 

“This reinforces the need for us as crime scene investigators to carry out careful scene processing and collection to maximise evidence recovery to provide strong and credible forensic analysis for investigations,” said Irene.",,
[FEATURED NEWS] HTX CONGRATULATES JANET ANG ON NMP APPOINTMENT,18-Jun-21,https://www.htx.gov.sg/news/featured-news-htx-congratulates-janet-ang-on-nmp-appointment,"HTX Board Member, Janet Ang, has been appointed by President Halimah Yacob as one of the nine Nominated Members of Parliament (NMPs) for a 2½ year term from January 21. 

The NMP scheme was introduced in 1990 to ensure a wide representation of views in Parliament.

A veteran in the tech industry, Janet currently chairs HTX’s Finance & Risk Committee. 

We would like to congratulate Janet and wish her every success in her undertakings.

HTX board member Janet Ang has been appointed NMP for a 2½ year term (Photo Credit: HTX)
",,
[MEDIA RELEASE] POLICE BEACON - JOINT NEWS RELEASE BY SINGAPORE POLICE FORCE AND HOME TEAM SCIENCE AND TECHNOLOGY AGENCY,18-Jun-21,https://www.htx.gov.sg/news/media-release-police-beacon---joint-news-release-by-singapore-police-force-and-home-team-science-and-technology-agency,"Police Beacon 
The Singapore Police Force (SPF) and HTX (Home Team Science and Technology Agency) will trial two prototypes of the Police Beacon to augment the Police’s operations at Punggol Waterway Park Connector and Sengkang Riverside Park Connector for a year from December 2020.

The Police Beacon aims to enhance police presence, increase accessibility to emergency services and improve police response to those in need of police assistance in locations that are quieter and more secluded. These are achieved through the integration of various technologies within the Police Beacon. 

Enhanced police presence - The Police Beacon and its CCTVs serve as a visible projection of police presence even when Police officers are not physically present. 
Increased accessibility - Members of the public can be connected quickly and directly to the Police via the Police Beacon should they require police assistance in emergency situations, especially in locations which are quieter with lower human traffic. 
Improved response – The Police Beacon is equipped with a range of intervention tools including siren, blinkers, floodlights, speakers and CCTVs which can be activated to aid in interim sense-making by the Police and provide assistance to the public before the arrival of the responding Police officers. 
The key features of the Police Beacon include:

Motion detection lights. Lights furnished with motion detectors will turn on when a person approaches the Police Beacon. These lights seek to enhance public safety at night, especially in quiet locations.  
Communications button linked to Police Operations Command Centre (POCC). Members of the public can have direct and real-time access to the Police during an emergency. Through direct interaction with the Police, members of the public will be able to interact directly with the Police, provide information and request for help. 
CCTVs. The real-time video footages of the Police Beacon’s surroundings can be viewed at POCC, and will complement the Police’s sense-making and incident management capabilities. With the CCTVs, the Police can better assess live situations and thus be better equipped to assist members of the public in real time.
Police warning system. The blinkers, siren, floodlights and speakers can be remotely operated by the POCC, and can serve as an interim intervention option to provide assistance to members of the public before Police officers arrive. 
Electronic screen. The electronic screen will display crime prevention messages in support of the Police’s outreach efforts.
Automated External Defibrillator (AED). Members of the public can have immediate access to interim medical help in an emergency. The Police will also be alerted when the AED box is accessed, and assess if emergency medical services need to be mobilised.
With these capabilities, the Police Beacon will serve to further deter crime and enhance public safety. Should the trial prove to be successful, the public can look forward to seeing more Police Beacons being deployed in park connectors and other public spaces in future.

The Policing Programme Management Centre (PPMC) at HTX worked with SPF to conceptualise and design the Police Beacon. Bernard Phang, Director of PPMC said, “The Police Beacon is an integration of various technologies such as audio and live-video technologies, and sensors to enable the Police to respond much faster to incidents at public spaces. The Police Beacon acts as an additional node for the public to report incidents during emergencies at the press of a button and facilitates Police intervention through remote activation. We look forward to continue working with the SPF to enhance the capability of the Beacon.”

Director of Operations, Senior Assistant Commissioner of Police Lian Ghim Hua said, “The Police Beacon aims to enhance the sense of public safety and provide members of the public with better accessibility to the Police, especially in times of emergency. It will further improve the Police’s operational effectiveness in deterring and responding to crime. The Police will continue to explore and adopt technology to enhance our capabilities to keep Singapore safe and secure.” 

PUBLIC AFFAIRS DEPARTMENT
SINGAPORE POLICE FORCE
11 DECEMBER 2020 @ 7.00PM


Front View of Police Beacon	Features
A: Siren / Blinkers (remotely activated from POCC)

B: CCTVs (provides real-time video footages to POCC) 

C: Floodlights (remotely activated from POCC)

D: Speakers (remotely activated from POCC) 

E: Electronic Screen (displays crime prevention messages)

F: Motion detection lights (lights up when a person approaches)

G: Communications Button (provides direct access to a Police operator in POCC)

G: AED Box

About Home Team Science and Technology Agency (HTX)

HTX is the world’s first Science and Technology agency that integrates a diverse range of scientific and engineering capabilities to innovate and deliver transformative and operationally-ready solutions for homeland security. As a statutory board of the Ministry of Home Affairs and integral to the Home Team, HTX works at the forefront of science and technology to empower Singapore’s frontline of security. Our shared mission is to amplify, augment and accelerate the Home Team’s advantage and secure Singapore as the safest place on planet earth.

For more information, visit our website at htx.gov.sg",,
