article_title,source_date,article_link,article_content,,* Source_date refers to the date that the article is placed into this CSV
[FEATURED NEWS] HTX’S FIRST LONG-DISTANCE BVLOS FLIGHTS A MILESTONE DEVELOPMENT FOR HOME TEAM OPS,18-Jun-21,https://www.htx.gov.sg/news/featured-news-htx-s-first-long-distance-bvlos-flights-a-milestone-development-for-home-team-ops,"With the successful implementation of HTX’s first long-distance Beyond Visual Line of Sight (BVLOS) flights for Unmanned Aerial Vehicles (UAVs), the Home Team is now able to further harness and apply this capability in areas such as saving lives and protecting properties, and enhancing public safety and security.

During the COVID-19 Circuit Breaker period, HTX augmented the Singapore Police Force’s resources on the ground by operating these BVLOS flights for patrolling operations around the industrial areas at Tuas South to ensure security. These autonomous flights enabled long distance and large area patrols, requiring only a very lean team to operate remotely.

Potential and Expanded Use of BVLOS UAV Flights

BVLOS UAVs are particularly useful to the Home Team for the conduct of patrols and security operations in areas which may be inaccessible or where situations are too risky for manual operations. BVLOS UAVs can also be used as a first responder to provide a situational picture of an incident site, such as a big-scale or high-security event with large crowds, and for sustained and routine patrols. As videos from the UAVs can be streamed to the Police Operations Command Centre, the Police can rapidly view and assess the situation before deciding on the appropriate resources to send to the ground.

Other situations where BVLOS UAVs can play a critical role include the detection of hazardous materials, the monitoring of fire scenes, and the delivery of essential supplies, which can include Automated External Defibrillators (AED) during critical missions like building collapses to help achieve a shorter response time for life-threatening cardiac arrest cases. The ability to commission BVLOS flights will increase the efficiency of Home Team operations and empower frontline officers to focus on higher-order tasks.

Mr K Shanmugam, Minister for Home Affairs and Minister for Law, viewed a BVLOS UAV flight demonstration at the Tuas View Fire Station today. He said: “This development is a key milestone in the Home Team’s use of cutting-edge technologies to transform the way we operate. HTX and the Home Team Departments must continue to innovate and find ways to harness technology to enhance the Home Team’s effectiveness in keeping Singapore safe and secure.”

Minister K. Shanmugam (in pink shirt) listening to a presentation on the drone features and capabilities during his visit to Tuas View Fire Station on 16 September 2020 (Photo: HTX)

[From left] SCDF Commissioner Eric Yap, HTX Chief Executive Chan Tsan, Minister K. Shanmugam, Commissioner of Police Hoong Wee Teck, ST Engineering Chairman Kwa Chong Seng at the Tuas View Fire Station rooftop to witness the take-off of a BVLOS flight (Photo: HTX)

(Photo: HTX)

HTX is currently working with various Home Team departments to design and customise effective BVLOS UAV solutions to meet their specific needs and requirements.

Senior Assistant Commissioner of Police (SAC) How Kwang Hwee, Director of Operations Department, said, “The Singapore Police Force (SPF) continues to work with HTX and industry partners to embrace new technologies to enhance our operational capabilities. The development of BVLOS drones is the next phase in SPF’s UAV operations. Recently, BVLOS drones have been successfully deployed to complement officers on the ground in various operations.”

Innovative Tech Enabling BVLOS UAV Flights

HTX’s Robotics, Automation & Unmanned Systems (RAUS) Centre of Expertise (CoE) worked with ST Engineering Aerospace to develop the Vertical Take-Off and Landing (VTOL) hexacopter drone that was used to conduct the BVLOS flight.

Autonomously launch and recover

The hexacopter drone uses a Drone Box concept, which allows it to autonomously launch and recover. “The Drone Box has a robotic automation system which can rapidly change out the depleted battery of the hexacopter drone and prepare it for its next mission”, said Director of HTX’s RAUS CoE, Cheng Wee Kiang, “Within the Drone Box, there is also a batch of drone batteries that are being charged and ready to be installed. This feature allows for a quick turnaround during operations without the need for manual intervention.”

Autonomously swap payloads

The automated payload swap feature of the Drone Box outfits the drone with the most effective payload for each specific operation. Such payload could comprise cameras, HazMat detectors or mechanisms for the delivery of items such as AEDs. “The automated payload swap means that the payloads can be adapted to different missions and situations swiftly. Since the mundane and time-consuming tasks are taken care of by automation, it will tremendously improve the agility and efficiency of the Home Team’s operations”, Mr Cheng added.

Fly longer distances in a shorter time

The operating concept of the Drone Box also enables the hexacopter drone to fly longer distances over sub-urban areas. According to Mr Cheng, the VTOL hexacopter drone can achieve a flight distance of a few kilometres in about 30 minutes, and also cover more areas within a shorter time.

The HTX RAUS team involved in the development of this advanced drone capability: (from left) Vanessia Choo, Low Hsien Ming, Cheng Wee Kiang, Chua Song Heng, Looi Xinglun (Photo: HTX)",,
[FEATURED NEWS] CATCHING CRIMINALS IN THE INTERNET AGE,18-Jun-21,https://www.htx.gov.sg/news/featured-news-catching-criminals-in-the-internet-age,"The digital technology boom that has transformed our lives in the past two decades has also reshaped how criminal investigations are carried out. For example, the ubiquity of smartphones has made them invaluable for both criminals and the police, and today up to 97% of criminal investigations rely on data from smartphones as a critical source of evidence.

Police departments around the world have been adding digital technologies to their investigative toolkits, and Singapore is no exception. HTX’s Digital and Information Forensics Centre of Expertise (DIF CoE) has been a leader in deploying cutting-edge technologies in both on-scene and laboratory digital forensics work to enable investigators to recover evidence from crime scenes and rapidly obtain actionable leads to apprehend the criminals.

The range of crimes that can be solved with digital forensics is large and grows larger each day.  James Lan, Acting Deputy Director at DIF CoE, has used digital forensics to solve all sorts of cases including love scams and illegal moneylending, using data extracted from phones, laptops, and other gadgets: “We can gather evidence from SMS and WhatsApp text messages, emails, smart devices like Google Home, and even GPS co-ordinates can help us to ascertain if the subject was where he claimed he was.”

Senior Forensics Examiner Mohamad Ridzuan using the Chip-Off machine to recover data from damaged mobile devices. Looking on are Acting Deputy Director James Lan (extreme left) and his team-mates from the Digital & Information Forensics forward deployed team at HTX (Photo: HTX)

New Tools for the Digital Age

The scientists and engineers of DIF CoE have developed a range of new tools for the recovery and processing of digital evidence. These include the Digital Forensic Kiosk which investigators -- including those without technical backgrounds -- can use to easily extract and analyse evidence from smartphones and other digital devices. Another tool being developed by the CoE is the Digital Evidence Search Tool (DIGEST), which investigators can use to automatically process large volumes of digital evidence, freeing up their time to concentrate on other aspects of their investigations.

Tools like DIGEST and the Digital Forensic Kiosk are important as HTX’s forensic examiners have to process thousands of electronic devices each year -- a number which will keep increasing -- with each device containing gigabytes or even terabytes of data.

As Lim Tuan Liang, the Director of DIF CoE, observes, “the big challenge is the exponential growth in the way that people are using digital devices and services,” and HTX’s scientists and engineers are continually exploring the best technological solutions to obtain “the most actionable insights” from this ever-growing mountain of data.

Senior Forensics Examiner Khairul Anwar Bin Ishak using the Digital Forensics Kiosk to extract and examine data from the mobile phone (Photo: HTX)

Keeping Up with the Latest Technologies

Apart from the large and growing quantity of data, HTX’s experts also have to keep themselves updated on the latest developments in hardware development, so that they can equip Singapore’s crime fighters with the capability to extract evidence from the ever-growing range of new electronic devices.

And it is not just physical gadgets. The rise of the Cloud means that investigators have to identify and comb through criminals’ cloud usage as well. As Tuan Liang notes, “In the past, when we arrested someone and seized their devices, we thought everything was there. But that’s not true anymore. If they are using cloud services, they might not store anything on these devices.”

This never-ending need to keep up with technology means that the digital transformation of crime investigation will be a continual process, and as Tuan Liang points out, “the traditional model of investigation is going to be overturned.”

One example of the challenge posed by technological change comes from Mohamad Ridzuan, a Senior Forensics Examiner at DIF CoE: “New technologies are emerging all the time. With better encryption, everything is increasingly more secure, and it is a growing challenge to extract data.” 

Close-up of Ridzuan performing the removal of storage chip from the logic board (Photo: HTX)

Passion for Technology and Justice

Like many of the other scientists and engineers at HTX, the DIF CoE director had a childhood passion for technology. His journey began when an uncle gave him an Apple ][ computer, which allowed him to learn how to code in BASIC. From that early beginning he moved on “to future generations of computers, and eventually to the mobile devices we have today, which are more powerful than anything we had then.”

Tuan Liang also has a passion for justice, and he joined the Singapore Police Force after graduating from university. He combined his passions for justice and technology in the field of digital forensics, and prior to leading DIF CoE, he spent almost a decade as the SPF’s Head of Technology Crime Forensic.

Lim Tuan Liang (left) showing then President of Singapore, Tony Tan Keng Yam, the mobile forensic tool, on 27 April 2016 (Photo: HTX)

Today, the COVID-19 pandemic -- in particular, the difficulty of working from home without access to the lab -- has helped to accelerate one of the director’s long-term projects, which is to enable HTX officers to “work anywhere at any time.” As he stated in a recent interview, “in three years’ time we hopefully will have moved 80% to 90% into a cloud-based environment.”

This future move to the Cloud will empower officers to collect, process and analyse evidence at any location without having to return to or rely on the lab, hence saving precious time when solving crimes. These and other innovations in Digital and Information Forensics will continue to shape the Home Team’s digital transformation.

Watch this video learn more about how HTX’s DIF CoE and Forensics CoE are empowering our frontlines in crime-solving.

(Source: HTX)",,
[MEDIA RELEASE] APPOINTMENT OF NEW MEMBERS TO HTX BOARD,18-Jun-21,https://www.htx.gov.sg/news/media-release-appointment-of-new-members-to-htx-board,"[Media Release]
 

APPOINTMENT OF NEW MEMBERS TO HTX BOARD

The Ministry of Home Affairs (MHA) will appoint three leaders, two from the industry and one from the Home Team, to the Home Team Science and Technology Agency (HTX) Board of Directors. 

They are:

a. Mr Tham Kok Leong, Partner (Head of Technology & Corporate Intellectual Property Practice) at Allen & Gledhill LLP. He will join the HTX Board from 1 September 2020

b. Ms Chew Seow-Chien, Partner (Head of Southeast Asia Financial Services Practice) at Bain & Company. She will join the HTX Board from 1 September 2020.

c. Ms Shie Yong Lee, Commissioner of Prisons (Designate). She will join the HTX Board from 28 September 2020.


MHA and HTX would like to thank Mr Desmond Chin, Commissioner of Prisons, for his service on the HTX Board. Mr Chin will step down from the HTX Board on 28 September 2020 when he retires from the Singapore Prison Service.


HTX, a statutory board under MHA, was established on 1 December 2019 to develop science and technology capabilities that will enable Home Team departments to better address the emerging threats and evolving challenges on the security landscape. HTX aims to be the force multiplier for the Home Team.


The HTX board is chaired by Mr Chew Hock Yong, who is also Permanent Secretary (Home Affairs Development) in the Ministry of Home Affairs.


MINISTRY OF HOME AFFAIRS
1 SEPTEMBER 2020",,
[FEATURED NEWS] GREAT EXPECTATIONS OF AN S&T FUTURE AT HTX,18-Jun-21,https://www.htx.gov.sg/news/featured-news-great-expectations-of-an-s-t-future-at-htx,"For three young men, it is a dream come true to receive the Home Team Scholarships this year. Peter Dumont, Choo Ze Xian, and Li Kangli have been fascinated with Science and Tech (S&T) for a long time, and look forward to being equipped with the knowledge and skills to make a real difference to lives. Among 14 scholars who received their awards on 20 August 2020, these three students will be joining HTX upon graduation from university.

Peter will be pursuing his studies in Microbial Biology at the University of California, Berkeley. Ze Xian and Kangli will both be studying Computer Science. Kangli will pursue his studies at the National University of Singapore, while Ze Xian is waiting for confirmation of his university placement.

All three were immensely grateful for the scholarship that will enable them to pursue their passions in S&T. Peter and Ze Xian were awarded the SGS MHA Merit Scholarship, and Kangli received the Home Team Local Study Award.

Read more about the Home Team Scholarships here.

Peter Dumont (Photo: Home Team News)

Choo Ze Xian (Photo: Home Team News)

Li Kangli (Photo: Home Team News)

 

We caught up with the boys to hear their thoughts on the award and HTX.

 

Congratulations on your awards! Please share with us how you feel about the scholarship.

Peter: The scholarship has opened the door to many opportunities, and I’m very grateful to be attached to an agency that I’m genuinely looking forward to begin a career at. I’m excited to help grow HTX!

Ze Xian: It is truly a once-in-a-lifetime experience. While I’m ecstatic to have been chosen, I also understand that it is a precious symbol of responsibility and duty of giving back to Singapore.

Kangli: I’m very honoured to receive the scholarship. Having taken the polytechnic instead of junior college route, which is something out of the norm, I hope that my example can encourage people to recognise that if polytechnic students work hard enough, they too can achieve success.

 

What sparked your interest in S&T? What attracted you to join HTX?

Peter: I used to read a lot of mystery novels, such as those by Agatha Christie, and had a little taste of investigative work in school through biology. I also had the opportunity to do a course overseas at Princeton University on epidemiology and learnt how the spread of diseases can be traced to different patients. At HTX, I would be able to marry my interest in police work and biology research. I wanted a career path that had a lot more meaning while being able to see the fruits of my work on the ground.

Ze Xian: Since I was in Year 3 of secondary school, I started dabbling in various projects that could have real-life applications. For instance, while I was serving the nation, I created a sentiment analyser with the aim of reading a chunk of text to tell whether the writer was happy or sad. At HTX, I again saw this real-life application when news broke recently that HTX was involved in the screening of COVID-19 at Singapore’s borders. I wanted to be part of this up and coming agency tasked with the mandate to tackle new, growing problems.

Kangli: I’ve always loved watching crime-solving series like Sherlock Holmes and Forensic Heroes where they examine trails left behind by criminals to crack the case. My passion for Digital Forensics was sparked by my National Service stint with HTX’s Digital and Information Forensics team. I saw first-hand how a forensics examiner worked, and was exposed to advanced techniques (such as chip-off forensics) to extract data from non-working devices. The work was so interesting and exclusive, I knew I had to return!

 

What do you hope to achieve in the field of S&T?

Peter: I hope to find a niche area in Microbial Biology that is useful in growing the capabilities of HTX. As I’ll be studying a lot about viruses and pathogens, I could probably branch off into a related topic like immunology. I saw that HTX was quite heavily mobilised for fast-response COVID-19 measures. It will definitely be useful if more people could contribute to such an effort in future, should another pandemic strike.

Ze Xian: To apply S&T meaningfully, I hope to utilise technology to touch the lives of every Singaporean. This can be through the development of advanced systems or applications that will boost the effectiveness or security of day-to-day processes, impacting the everyday lives of Singaporeans.

Kangli: As HTX’s digital forensics team continues to ramp up its capabilities by tapping on emerging tech, I want to be a subject matter expert in digital forensics. I hope to develop useful tools to solve crimes easily and legally.",,
[FEATURED NEWS] KEEPING SINGAPORE SAFE AGAINST ROGUE DRONES,18-Jun-21,https://www.htx.gov.sg/news/featured-news-keeping-singapore-safe-against-rogue-drones,"These days, drones are an omnipresent sight in the skies. From delivering food, to supporting Police operations during COVID-19, the proliferation of unmanned aerial vehicles (UAVs) has contributed to many use cases across a spectrum of industries. But when drones land in the hands of the wrong persons, it can be a serious threat to public safety. Take for instance, on 18 June 2019, several unauthorised drones intruded into Singapore’s restricted airspace and disrupted operations for about ten hours. 38 flights were delayed and one of the runways had to be closed intermittently.

Rogue drones have not just caused near-accidents; they have been used to courier drugs and contrabands to prisoners and even used in assassination attempts or incidents around the world. Not only do illegal drone flights cause financial loss, they can be potentially dangerous to lives and properties.

So what can be done to detect and counter these rogue drones?

One innovative solution is the XENTINEL Mobile Response Vehicle – a purpose-built anti-drone mobile response vehicle.

A light and nimble vehicle platform, the XENTINEL is equipped with capabilities to detect drones at good standoff distance, thereby allowing officers to have adequate time for effective interdiction. The vehicle only requires one officer to operate it and is designed to be ready within minutes to be swiftly deployed.  This is a quantum leap from the current method of countering drones.

(Photo: HTX)

“The challenge given to us was how could we perform counter-drone operations more effectively with just one personnel? Using a combination of cutting-edge technologies, we developed a mobile and rapid deployable system that was capable of countering rogue drones effectively. Using state-of-the art technology, the systems on board the vehicle can detect and interdict drones at far greater range than a human operator. The vehicle is easy-to-operate and lean-on-manpower design. In every sense, the XENTINEL is a force multiplier to our counter-drone capabilities,” explains Eric Chua, Director of Land Systems Centre of Expertise (CoE) at HTX and co-Project Team Leader of the XENTINEL project.

The team from Land Systems CoE collaborated with the Robotics, Automation, and Unmanned Systems (RAUS) CoE, Singapore Police Force (SPF), DSO, and ST Engineering to conceptualise, design and integrate the required sensors into the vehicle platform.

Key Features of XENTINEL:

Equipped with different sensors to detect presence of drone signals and disrupt rogue drone operations;
Equipped with cameras to provide visual confirmation of the drones;
Intuitive user interface;
Modular subsystems allowing for easy maintenance.

(Photo: HTX)

Director of RAUS CoE and Co-Project Team Leader, Cheng Wee Kiang says that this project cements Singapore’s standing and commitment to safety and security using science and technology. “The development of the XENTINEL sets a new benchmark for delivering full spectrum counter drone capabilities to the Home Team. The capabilities contribute significantly to addressing the evolving security needs. This original capability has proven to be superior in application, as the development and deployment is meticulously customised and optimised for Singapore’s unique operating landscape.”

Some of the project members with XENTINEL (Photo: HTX)

For the excellent teamwork, dedication to duty, operational efficiency, and integration of innovative technologies, the Xentinel project team was recently presented with the Minister for Home Affairs National Day Award.

In the next few months, the XENTINEL will be qualified for roadworthiness and ready for trials with the SPF.",,
[FEATURED NEWS] CONGRATULATIONS TO OUR NATIONAL DAY AWARDS RECIPIENTS!,18-Jun-21,https://www.htx.gov.sg/news/featured-news-congratulations-to-our-national-day-awards-recipients!,"This year, 19 HTX officers received the National Day Awards 2020. Immigration & Checkpoints Programme Management Centre (ICPMC) Director Tan Sor Hoon, was presented with the Public Administration Medal (Silver) for her outstanding efficiency, competence, and industry. She was among eight highly experienced Home Team Silver Medallists this year who have made many significant contributions to the public service and homeland security over the years.

 


Public Administration Medal (Silver) Recipient – Tan Sor Hoon, Director, ICPMC

For Sor Hoon, leveraging emerging technologies to create future-ready checkpoints that are efficient, secure, integrated, and smart lies at the core of her current work at HTX’s ICPMC. “Our work in biometrics brings us one step closer to the Immigration & Checkpoints Authority’s (ICA) vision of an efficient and hassle-free immigration clearance experience,” said Sor Hoon.

She felt fortunate to have a team of committed officers with positive attitudes, who can deliver despite being new and overcome the challenges to support the large portfolio for ICA. This portfolio, she said, comprises close to 100 development projects as well as Infrastructure and ICT equipment located at ICA HQ, more than 30 immigration checkpoints island-wide, and more than 40 overseas missions in various countries and strategic partners like Institutes of Higher Learning and hospitals.

On her Public Administration Medal (Silver) award, Sor Hoon said, “This award may have my name on it, but in truth it belongs to everybody who has supported or worked with me to make it a reality. The award is a reminder of the hard work my team and I have put in. It motivates us to achieve more success in the future.”

Read more about Sor Hoon and her work at ICPMC.

 


Two other HTX officers were awarded the National Day Awards (Efficiency Medal). They are Stephen Tay Chee Meng and Kwa Hee Boon.

In addition, 16 HTX officers received the Long Service Medal for having served at least 25 years in the public service.

Stephen is Officer-in-Charge (Photo & Technical Aid) at HTX’s Forensics Centre of Expertise, and Hee Boon is the Head, Northern Operation & Sustainment, Patrol Boats, Marine Systems, at HTX’s Platform Systems Sustainment Centre. The National Day Awards recognise public servants’ various forms of merit and service to Singapore in their respective areas of work.

 

Efficiency Medal Recipients

Stephen (3rd from left) at the Home Team Festival 2019 (Photo: Stephen Tay)

Stephen is in charge of the Photo and Tech Aid team in Forensics Division of the Criminal Investigation Department where he manages all photographic and technical aid services for the Singapore Police Force and external agencies, and supervises his officers’ work in the procurement of photographic equipment and consumables.

He is also in charge of numerous projects such as implementing Radix 2, procuring the Facial Recognition System, and working on a Proof-of-Concept on generating near-real time leads.

(Photo: Kwa Hwee Boon)

Hee Boon is the Officer-in-Charge of the Marine Workshop in Police Coast Guard (PCG) Gul Regional Base, managing a group of 15 technicians and 10 contractors to maintain 24 PCG patrol boats.

His job requires him to plan and execute the maintenance programme for these 24 PCG patrol boats ensuring operational availability to meet PCG operational needs for Gul Regional Base.

 

Congratulations again to all our winners!",,
